{
  "schema_version": "1.0.0",
  "case_id": "RLC-PRA-STD-REQ-001-MIGRATION",
  "intake_type": "source_document",
  "status": "decision_required",
  "created_at": "2026-10-09T16:33:09Z",
  "source": {
    "source_id": "PRA-STD-REQ-001",
    "source_path": "docs/governance/source-documents/PRA-STD-SRC-001.requirements.md",
    "source_sha256": "730f3a1f5875ec76f3d032c9f620630fc68846d4722c28803b16c8ab50902d3b",
    "owner": "platform-owners",
    "decision_ref": "docs/governance/change-requests/GCR-2026-143-hybrid-requirement-lifecycle.md"
  },
  "proposals": [
    {
      "proposal_id": "RLC-PRA-STD-REQ-001-MIGRATION-P0001",
      "source_requirement_id": "PRA-STD-SRC-001-REQ-001",
      "title": "Aim and Purpose",
      "statement": "The DevSecOps platform shall enable a controlled and repeatable software delivery across all programs.",
      "normative_strength": "MUST",
      "domain": "platform",
      "analysis": {
        "suggested_classification": "new",
        "confidence": 1.0,
        "candidate_matches": [],
        "method": "no_catalog_match"
      },
      "decision": null,
      "activation": null
    },
    {
      "proposal_id": "RLC-PRA-STD-REQ-001-MIGRATION-P0002",
      "source_requirement_id": "PRA-STD-SRC-001-REQ-002",
      "title": "The Chief Digitalisation Office",
      "statement": "When a version is quoted, this version shall be used.",
      "normative_strength": "MUST",
      "domain": "platform",
      "analysis": {
        "suggested_classification": "duplicate",
        "confidence": 1.0,
        "candidate_matches": [
          {
            "requirement_id": "RLC-DSCB-STD-REQ-001-MIGRATION-P0004",
            "similarity": 1.0
          },
          {
            "requirement_id": "RLC-PRA-STD-REQ-001-MIGRATION-P0015",
            "similarity": 0.4242
          }
        ],
        "method": "deterministic_exact"
      },
      "decision": null,
      "activation": null
    },
    {
      "proposal_id": "RLC-PRA-STD-REQ-001-MIGRATION-P0003",
      "source_requirement_id": "PRA-STD-SRC-001-REQ-003",
      "title": "Scope",
      "statement": "Domain-specific variants (e.g., classified environments) shall conform to this reference architecture.",
      "normative_strength": "MUST",
      "domain": "platform",
      "analysis": {
        "suggested_classification": "new",
        "confidence": 1.0,
        "candidate_matches": [],
        "method": "no_catalog_match"
      },
      "decision": null,
      "activation": null
    },
    {
      "proposal_id": "RLC-PRA-STD-REQ-001-MIGRATION-P0004",
      "source_requirement_id": "PRA-STD-SRC-001-REQ-004",
      "title": "DevSecOps Platform Stack Architecture Overview Strategic Authority",
      "statement": "The enterprise DevSecOps platform shall implement the following logical architecture layers:",
      "normative_strength": "MUST",
      "domain": "platform",
      "analysis": {
        "suggested_classification": "new",
        "confidence": 0.3977,
        "candidate_matches": [
          {
            "requirement_id": "RLC-PRA-STD-REQ-001-MIGRATION-P0051",
            "similarity": 0.6023
          },
          {
            "requirement_id": "RLC-PRA-STD-REQ-001-MIGRATION-P0006",
            "similarity": 0.5904
          },
          {
            "requirement_id": "RLC-ARCH-EA-REQ-001-MIGRATION-P0022",
            "similarity": 0.559
          }
        ],
        "method": "no_catalog_match"
      },
      "decision": {
        "disposition": "reject",
        "classification": "new",
        "target_requirement_id": null,
        "decided_by": "joku",
        "decision_role": "platform-owner",
        "decided_at": "2026-10-09T20:11:18Z",
        "decision_ref": "docs/governance/change-requests/GCR-2026-147-pra-first-wave-decision.md",
        "rationale": "Rejected as a standalone canonical requirement according to PRA-2026-001; source evidence remains preserved.",
        "authorized_derivations": [],
        "runtime_enforcement": "none"
      },
      "activation": null
    },
    {
      "proposal_id": "RLC-PRA-STD-REQ-001-MIGRATION-P0005",
      "source_requirement_id": "PRA-STD-SRC-001-REQ-005",
      "title": "Operational Monitoring Layer",
      "statement": "Platform Stack Capability Requirements",
      "normative_strength": "REQUIREMENT",
      "domain": "platform",
      "analysis": {
        "suggested_classification": "new",
        "confidence": 1.0,
        "candidate_matches": [],
        "method": "no_catalog_match"
      },
      "decision": {
        "disposition": "reject",
        "classification": "new",
        "target_requirement_id": null,
        "decided_by": "joku",
        "decision_role": "platform-owner",
        "decided_at": "2026-10-09T20:11:18Z",
        "decision_ref": "docs/governance/change-requests/GCR-2026-147-pra-first-wave-decision.md",
        "rationale": "Rejected as a standalone canonical requirement according to PRA-2026-001; source evidence remains preserved.",
        "authorized_derivations": [],
        "runtime_enforcement": "none"
      },
      "activation": null
    },
    {
      "proposal_id": "RLC-PRA-STD-REQ-001-MIGRATION-P0006",
      "source_requirement_id": "PRA-STD-SRC-001-REQ-006",
      "title": "Operational Monitoring Layer",
      "statement": "Each platform instance shall implement the following mandatory capabilities.",
      "normative_strength": "MUST",
      "domain": "platform",
      "analysis": {
        "suggested_classification": "new",
        "confidence": 0.3976,
        "candidate_matches": [
          {
            "requirement_id": "RLC-PRA-STD-REQ-001-MIGRATION-P0004",
            "similarity": 0.6024
          }
        ],
        "method": "no_catalog_match"
      },
      "decision": {
        "disposition": "reject",
        "classification": "new",
        "target_requirement_id": null,
        "decided_by": "joku",
        "decision_role": "platform-owner",
        "decided_at": "2026-10-09T20:11:18Z",
        "decision_ref": "docs/governance/change-requests/GCR-2026-147-pra-first-wave-decision.md",
        "rationale": "Rejected as a standalone canonical requirement according to PRA-2026-001; source evidence remains preserved.",
        "authorized_derivations": [],
        "runtime_enforcement": "none"
      },
      "activation": null
    },
    {
      "proposal_id": "RLC-PRA-STD-REQ-001-MIGRATION-P0007",
      "source_requirement_id": "PRA-STD-SRC-001-REQ-007",
      "title": "Objective",
      "statement": "Developers shall use approved development environments.",
      "normative_strength": "MUST",
      "domain": "platform",
      "analysis": {
        "suggested_classification": "new",
        "confidence": 1.0,
        "candidate_matches": [],
        "method": "no_catalog_match"
      },
      "decision": null,
      "activation": null
    },
    {
      "proposal_id": "RLC-PRA-STD-REQ-001-MIGRATION-P0008",
      "source_requirement_id": "PRA-STD-SRC-001-REQ-008",
      "title": "Objective",
      "statement": "Access to development environments shall be authenticated via enterprise identity management.",
      "normative_strength": "MUST",
      "domain": "platform",
      "analysis": {
        "suggested_classification": "new",
        "confidence": 0.4315,
        "candidate_matches": [
          {
            "requirement_id": "RLC-DSCB-STD-REQ-001-MIGRATION-P0028",
            "similarity": 0.5685
          },
          {
            "requirement_id": "RLC-PRA-STD-REQ-001-MIGRATION-P0011",
            "similarity": 0.4414
          }
        ],
        "method": "no_catalog_match"
      },
      "decision": {
        "disposition": "approve",
        "classification": "duplicate",
        "target_requirement_id": "GRQ-000019",
        "decided_by": "joku",
        "decision_role": "platform-owner",
        "decided_at": "2026-10-09T20:11:18Z",
        "decision_ref": "docs/governance/change-requests/GCR-2026-147-pra-first-wave-decision.md",
        "rationale": "Approved according to the complete PRA-2026-001 human review recommendation.",
        "authorized_derivations": [
          "platform"
        ],
        "runtime_enforcement": "none"
      },
      "activation": null
    },
    {
      "proposal_id": "RLC-PRA-STD-REQ-001-MIGRATION-P0009",
      "source_requirement_id": "PRA-STD-SRC-001-REQ-009",
      "title": "Objective",
      "statement": "Access rights shall follow role-based access control.",
      "normative_strength": "MUST",
      "domain": "platform",
      "analysis": {
        "suggested_classification": "new",
        "confidence": 1.0,
        "candidate_matches": [],
        "method": "no_catalog_match"
      },
      "decision": {
        "disposition": "approve",
        "classification": "extend",
        "target_requirement_id": "GRQ-000019",
        "decided_by": "joku",
        "decision_role": "platform-owner",
        "decided_at": "2026-10-09T20:11:18Z",
        "decision_ref": "docs/governance/change-requests/GCR-2026-147-pra-first-wave-decision.md",
        "rationale": "Approved according to the complete PRA-2026-001 human review recommendation.",
        "authorized_derivations": [
          "platform"
        ],
        "runtime_enforcement": "none"
      },
      "activation": {
        "requirement_id": "GRQ-000047",
        "revision": 1,
        "effective_from": "2026-10-09",
        "commit": "eaa9c10f1d03ed32f3140007b27cb771e71e0184"
      }
    },
    {
      "proposal_id": "RLC-PRA-STD-REQ-001-MIGRATION-P0010",
      "source_requirement_id": "PRA-STD-SRC-001-REQ-010",
      "title": "Objective",
      "statement": "Source code shall be stored in enterprise-approved version control systems.",
      "normative_strength": "MUST",
      "domain": "platform",
      "analysis": {
        "suggested_classification": "new",
        "confidence": 0.3984,
        "candidate_matches": [
          {
            "requirement_id": "RLC-PRA-STD-REQ-001-MIGRATION-P0026",